{
  "$schema": "https://json-schema.org/draft/2020-12/schema",
  "$id": "urn:vitrine:schema:registry-package:v1",
  "title": "Vitrine-Registry-Paketeintrag (packages/<id>.json)",
  "description": "Schema fuer eine Datei unter 'packages/<id>.json' im Katalog-Repo 'vitrine-registry' (M4/K1). Ein Eintrag pro veroeffentlichtem Paket: Metadaten, Autor, Kategorie, alle Versionen mit Download-/Pruefsummen-/Signaturinfo. Der Index-Builder (registry/build-index.js) liest diese Dateien und erzeugt daraus index/index.json, search.json und featured.json. Charter-Regel 8: dasselbe Format, das der Index-Builder hier schreibt, liest spaeter der Katalog-Client im Mod (K2) -- kein zweites Format.\n\nGATE6/J2: 'contentClass' unterscheidet Klasse A ('resource', Default wenn das Feld fehlt -- volle Rueckwaertskompatibilitaet mit bestehenden Eintraegen) von Klasse B ('javamod', ein .jar-Angebot, das im Mod ueber JavaModStager.stage(...) landet, nie hot -- Charter-Regel 2). Je nach 'contentClass' verlangt jeder Eintrag in 'versions' entweder das 'resource'-Trio ('vpkgUrl'/'sha256'/'signature') oder das 'javamod'-Trio ('jarUrl'/'fileName'/'sha256'/'signature'), s. $defs/resourceVersionItem und $defs/javamodVersionItem unten sowie das if/then/else auf Dokumentebene. 'category' bleibt davon unberuehrt -- eine reine inhaltliche Kategorie, orthogonal zu 'contentClass'.",
  "type": "object",
  "additionalProperties": false,
  "required": [
    "schemaVersion",
    "id",
    "name",
    "category",
    "author",
    "license",
    "repository",
    "versions",
    "latestVersion",
    "updatedAt"
  ],
  "if": {
    "required": [
      "contentClass"
    ],
    "properties": {
      "contentClass": {
        "const": "javamod"
      }
    }
  },
  "then": {
    "properties": {
      "versions": {
        "items": {
          "$ref": "#/$defs/javamodVersionItem"
        }
      }
    }
  },
  "else": {
    "properties": {
      "versions": {
        "items": {
          "$ref": "#/$defs/resourceVersionItem"
        }
      }
    }
  },
  "$defs": {
    "resourceVersionItem": {
      "description": "Klasse A ('contentClass' fehlt oder ist 'resource'): ein .vpkg-Release-Asset.",
      "type": "object",
      "additionalProperties": false,
      "required": [
        "version",
        "vpkgUrl",
        "sha256",
        "signature",
        "size",
        "publishedAt"
      ],
      "properties": {
        "version": {
          "description": "SemVer 2.0.0.",
          "type": "string",
          "pattern": "^(0|[1-9]\\d*)\\.(0|[1-9]\\d*)\\.(0|[1-9]\\d*)(?:-((?:0|[1-9]\\d*|\\d*[a-zA-Z-][0-9a-zA-Z-]*)(?:\\.(?:0|[1-9]\\d*|\\d*[a-zA-Z-][0-9a-zA-Z-]*))*))?(?:\\+([0-9a-zA-Z-]+(?:\\.[0-9a-zA-Z-]+)*))?$"
        },
        "vpkgUrl": {
          "description": "Absolute https-URL zum .vpkg-Release-Asset im Autoren-Repo.",
          "type": "string",
          "pattern": "^https://[^\\s]+\\.vpkg$",
          "maxLength": 1024
        },
        "sha256": {
          "description": "SHA-256-Pruefsumme des .vpkg-Archivs, hex, klein geschrieben (siehe mod/-seitige Pruefung P4).",
          "type": "string",
          "pattern": "^[0-9a-f]{64}$"
        },
        "signature": {
          "description": "ed25519-Signatur des .vpkg-Archivs, Base64-kodiert (siehe P4).",
          "type": "string",
          "pattern": "^[A-Za-z0-9+/]+={0,2}$",
          "minLength": 20,
          "maxLength": 256
        },
        "size": {
          "description": "Groesse des .vpkg-Archivs in Bytes.",
          "type": "integer",
          "minimum": 1,
          "maximum": 536870912
        },
        "minVitrineVersion": {
          "description": "Optionale Mindestversion des Vitrine-Mods, SemVer.",
          "type": "string",
          "pattern": "^(0|[1-9]\\d*)\\.(0|[1-9]\\d*)\\.(0|[1-9]\\d*)$"
        },
        "publishedAt": {
          "description": "Veroeffentlichungszeitpunkt dieser Version, ISO-8601/RFC-3339.",
          "type": "string",
          "format": "date-time"
        }
      }
    },
    "javamodVersionItem": {
      "description": "Klasse B ('contentClass' ist 'javamod'): ein .jar-Release-Asset, das der Mod ueber JavaModStager.stage(...) staged (J2). 'fileName' entspricht der Haertung in mod/src/main/java/de/spassglas/vitrine/classb/JavaModOffer.java#requireSafeJarFileName -- kein Pfadtrenner, kein '..', kein Laufwerksbuchstabe, beginnt nicht mit '.', endet auf '.jar'.",
      "type": "object",
      "additionalProperties": false,
      "required": [
        "version",
        "jarUrl",
        "fileName",
        "sha256",
        "signature",
        "size",
        "publishedAt"
      ],
      "properties": {
        "version": {
          "description": "SemVer 2.0.0.",
          "type": "string",
          "pattern": "^(0|[1-9]\\d*)\\.(0|[1-9]\\d*)\\.(0|[1-9]\\d*)(?:-((?:0|[1-9]\\d*|\\d*[a-zA-Z-][0-9a-zA-Z-]*)(?:\\.(?:0|[1-9]\\d*|\\d*[a-zA-Z-][0-9a-zA-Z-]*))*))?(?:\\+([0-9a-zA-Z-]+(?:\\.[0-9a-zA-Z-]+)*))?$"
        },
        "jarUrl": {
          "description": "Absolute https-URL zum .jar-Release-Asset im Autoren-Repo.",
          "type": "string",
          "pattern": "^https://[^\\s]+\\.jar$",
          "maxLength": 1024
        },
        "fileName": {
          "description": "Zieldateiname der Jar in 'mods/' -- kein Pfadtrenner ('/'  oder '\\\\'), kein Doppelpunkt, kein '..', beginnt nicht mit '.', endet auf '.jar' (siehe JavaModOffer#requireSafeJarFileName, mod-seitige Haertung desselben Werts).",
          "type": "string",
          "pattern": "^(?!\\.)(?!.*\\.\\.)[^\\\\/:]+\\.jar$",
          "minLength": 5,
          "maxLength": 255
        },
        "sha256": {
          "description": "SHA-256-Pruefsumme der .jar-Datei, hex, klein geschrieben (siehe mod/-seitige Pruefung in JavaModStager).",
          "type": "string",
          "pattern": "^[0-9a-f]{64}$"
        },
        "signature": {
          "description": "ed25519-Signatur der .jar-Datei, Base64-kodiert (Pflicht seit GATE33-Aequivalent fuer Klasse B, gleiche Bedeutung wie bei Klasse A).",
          "type": "string",
          "pattern": "^[A-Za-z0-9+/]+={0,2}$",
          "minLength": 20,
          "maxLength": 256
        },
        "size": {
          "description": "Groesse der .jar-Datei in Bytes.",
          "type": "integer",
          "minimum": 1,
          "maximum": 536870912
        },
        "minVitrineVersion": {
          "description": "Optionale Mindestversion des Vitrine-Mods, SemVer.",
          "type": "string",
          "pattern": "^(0|[1-9]\\d*)\\.(0|[1-9]\\d*)\\.(0|[1-9]\\d*)$"
        },
        "dependencies": {
          "description": "Optionale harte Fabric-Mod-Id-Abhaengigkeiten fuer die J3-Konfliktpruefung (FabricInstalledModConflictCheck) -- muessen vor dem Kopieren bereits installiert, vorgemerkt oder das Angebot selbst sein. Fehlt das Feld, gilt 'keine harten Abhaengigkeiten' (siehe JavaModOffer#dependencies).",
          "type": "array",
          "items": {
            "type": "string",
            "pattern": "^[a-z][a-z0-9-_]{1,63}$"
          },
          "uniqueItems": true,
          "maxItems": 64
        },
        "publishedAt": {
          "description": "Veroeffentlichungszeitpunkt dieser Version, ISO-8601/RFC-3339.",
          "type": "string",
          "format": "date-time"
        }
      }
    }
  },
  "properties": {
    "contentClass": {
      "description": "Inhaltsklasse des Pakets (GATE6/J2). Fehlt das Feld, gilt Klasse A ('resource') -- volle Rueckwaertskompatibilitaet mit allen bestehenden packages/<id>.json. 'javamod' ist Klasse B: ein .jar-Angebot, siehe $defs/javamodVersionItem. Orthogonal zu 'category' (bleibt eine reine inhaltliche Kategorie).",
      "type": "string",
      "enum": [
        "resource",
        "javamod"
      ]
    },
    "schemaVersion": {
      "description": "Version dieses Registry-Paketeintrag-Schemas. Aktuell fest auf 1.",
      "type": "integer",
      "const": 1
    },
    "id": {
      "description": "Eindeutiger Paket-Bezeichner, identisch mit dem 'id'-Feld im vitrine.json-Manifest des Pakets (siehe vitrine.schema.json). Wird als Dateiname verwendet: 'packages/<id>.json'.",
      "type": "string",
      "minLength": 3,
      "maxLength": 128,
      "pattern": "^[a-z][a-z0-9-]*(\\.[a-z][a-z0-9-]*)+$"
    },
    "name": {
      "description": "Anzeigename des Pakets im Store.",
      "type": "string",
      "minLength": 1,
      "maxLength": 80
    },
    "category": {
      "description": "Marktplatz-Kategorie, dieselben Werte wie im vitrine.json-Manifest.",
      "type": "string",
      "enum": [
        "texturen",
        "theme",
        "hud",
        "shader",
        "sound",
        "sprache",
        "cosmetics",
        "bundle",
        "addon"
      ]
    },
    "author": {
      "description": "Autor/Autorin des Pakets.",
      "type": "object",
      "additionalProperties": false,
      "required": [
        "name"
      ],
      "properties": {
        "name": {
          "type": "string",
          "minLength": 1,
          "maxLength": 80
        },
        "url": {
          "description": "Optionales Autoren-Profil, nur https.",
          "type": "string",
          "pattern": "^https://[^\\s]+$",
          "maxLength": 512
        }
      }
    },
    "description": {
      "description": "Freitext-Beschreibung fuer die Detailseite im Store.",
      "type": "string",
      "maxLength": 2000
    },
    "tags": {
      "description": "Freie Schlagworte fuer die Suche (search.json). Kleinbuchstaben, Ziffern, Bindestrich.",
      "type": "array",
      "items": {
        "type": "string",
        "pattern": "^[a-z][a-z0-9-]*$",
        "maxLength": 32
      },
      "uniqueItems": true,
      "maxItems": 16
    },
    "icon": {
      "description": "Absolute https-URL zu einem quadratischen PNG-Vorschausymbol (anders als im vitrine.json-Manifest: hier liegt das Icon nicht im ZIP, sondern wird ueber die Autoren-Release-Assets referenziert).",
      "type": "string",
      "pattern": "^https://[^\\s]+\\.png$",
      "maxLength": 512
    },
    "homepage": {
      "description": "Optionale https-Projektseite.",
      "type": "string",
      "pattern": "^https://[^\\s]+$",
      "maxLength": 512
    },
    "license": {
      "description": "Lizenz der Paketinhalte, Pflichtfeld. Muss auf registry/LICENSE-WHITELIST.md stehen -- der Index-Builder (registry/build-index.js) und die PR-Pruefung (registry/scripts/validate-changed-packages.mjs) lehnen nicht-whitelistete Werte ab (betrifft nur das Paket, nicht Vitrine selbst).",
      "type": "string",
      "minLength": 1,
      "maxLength": 100
    },
    "repository": {
      "description": "https-URL des Autoren-Repos, in dem die .vpkg-Artefakte als GitHub-Release-Assets liegen (Technische Festlegung: 'Katalog ohne Backend').",
      "type": "string",
      "pattern": "^https://[^\\s]+$",
      "maxLength": 512
    },
    "minecraftVersions": {
      "description": "GATE70-FOLLOW: Minecraft-Versionen, fuer die dieses Paket freigegeben ist, z. B. ['1.21.1', '1.21.4'] -- gleiche Vokabel, gleiches Muster wie 'javaMod.minecraftVersions' in vitrine.schema.json (dort Pflicht fuer Klasse B). Hier bewusst optional und nicht an 'contentClass' gebunden: docs/UI-SPEC.md zeigt 'MC-Versionen' im Kopfbereich jeder Detailseite, nicht nur bei Klasse-B-Angeboten, und bestehende packages/<id>.json-Dateien ohne dieses Feld bleiben gueltig (keine rueckwirkende Pflicht). Fehlt das Feld, zeigt die Detailseite ehrlich 'keine Angaben' (Charter-Regel 2) -- siehe mod/.../PackageDetailHeader#minecraftVersions.",
      "type": "array",
      "items": {
        "type": "string",
        "pattern": "^[1-9][0-9]*\\.[0-9]+(\\.[0-9]+)?$",
        "maxLength": 16
      },
      "minItems": 1,
      "maxItems": 32,
      "uniqueItems": true
    },
    "capabilities": {
      "description": "GATE90-FOLLOW: die Faehigkeits-Bezeichner ('APIs'), die dieses Paket im vitrine.json-Manifest anmelden wird -- dieselbe feste Whitelist wie 'mod/src/main/java/de/spassglas/vitrine/vpkg/VpkgCapability.java' und dasselbe Zeichenmuster/dieselben Beispiele wie 'capabilities' in vitrine.schema.json. Macht die Faehigkeiten eines Katalog-Angebots schon beim Abruf von 'packages/<id>.json' bekannt, VOR jedem Download (docs/UI-SPEC.md Abschnitt 8: 'Erscheint vor der ersten Installation eines Pakets') -- siehe CatalogPackInstaller#install(String, DownloadRequest, String, List, CancellationToken, DownloadProgress) (GATE90), der genau diese Vorab-Liste erwartet. Fehlt das Feld (aeltere Eintraege), gilt 'keine angemeldeten Faehigkeiten vorab bekannt' -- die endgueltige, bindende Pruefung bleibt in jedem Fall die echte vitrine.json nach dem Download (Charter-Regel 4). Muss mit den tatsaechlich im veroeffentlichten Paket angemeldeten Faehigkeiten uebereinstimmen; eine Abweichung ist ein Registry-Pflegefehler, keine Sicherheitsluecke, weil der Mod nach dem Download ohnehin erneut gegen die echte vitrine.json prueft.",
      "type": "array",
      "items": {
        "type": "string",
        "enum": [
          "texturen",
          "theme",
          "hud",
          "shader",
          "sound",
          "sprache",
          "cosmetics",
          "verhalten",
          "skript"
        ]
      },
      "uniqueItems": true,
      "maxItems": 9,
      "default": []
    },
    "versions": {
      "description": "Alle veroeffentlichten Versionen dieses Pakets, aelteste zuerst empfohlen. Mindestens eine. Die Form jedes Eintrags haengt von 'contentClass' ab -- siehe das if/then/else auf Dokumentebene und $defs/resourceVersionItem bzw. $defs/javamodVersionItem oben.",
      "type": "array",
      "minItems": 1,
      "maxItems": 500
    },
    "latestVersion": {
      "description": "SemVer der neuesten Version -- muss dem 'version'-Feld eines Eintrags in 'versions' entsprechen (vom Index-Builder geprueft, nicht per JSON-Schema ausdrueckbar).",
      "type": "string",
      "pattern": "^(0|[1-9]\\d*)\\.(0|[1-9]\\d*)\\.(0|[1-9]\\d*)(?:-((?:0|[1-9]\\d*|\\d*[a-zA-Z-][0-9a-zA-Z-]*)(?:\\.(?:0|[1-9]\\d*|\\d*[a-zA-Z-][0-9a-zA-Z-]*))*))?(?:\\+([0-9a-zA-Z-]+(?:\\.[0-9a-zA-Z-]+)*))?$"
    },
    "updatedAt": {
      "description": "Letzter Aenderungszeitpunkt dieses Registry-Eintrags (nicht des Pakets selbst).",
      "type": "string",
      "format": "date-time"
    },
    "featured": {
      "description": "Optionale Kuratierung fuer die 'items'-Liste in featured.json. Ohne dieses Feld erscheint das Paket nicht dort. Wird von den Registry-Maintainern bei der PR-Pruefung gesetzt, nicht vom Paketautor selbst (Interessenkonflikt) -- siehe CONTRIBUTING.md.",
      "type": "object",
      "additionalProperties": false,
      "required": [
        "order"
      ],
      "properties": {
        "order": {
          "description": "Sortierposition, aufsteigend, kleinere Zahl zuerst.",
          "type": "integer",
          "minimum": 0
        },
        "note": {
          "description": "Kurzer Kurationstext, z. B. warum das Paket hervorgehoben wird.",
          "type": "string",
          "maxLength": 200
        }
      }
    },
    "popular": {
      "description": "Optionale Kuratierung fuer die 'popular'-Liste in featured.json (redaktionell, kein echter Download-/Nutzungszaehler -- Vitrine hat bewusst kein Backend, das sowas seriös messen koennte). Ohne dieses Feld erscheint das Paket nicht dort. Wird von den Registry-Maintainern bei der PR-Pruefung gesetzt, nicht vom Paketautor selbst (Interessenkonflikt) -- siehe CONTRIBUTING.md.",
      "type": "object",
      "additionalProperties": false,
      "required": [
        "order"
      ],
      "properties": {
        "order": {
          "description": "Sortierposition, aufsteigend, kleinere Zahl zuerst.",
          "type": "integer",
          "minimum": 0
        },
        "note": {
          "description": "Kurzer Kurationstext, z. B. warum das Paket als beliebt gefuehrt wird.",
          "type": "string",
          "maxLength": 200
        }
      }
    }
  }
}
