{
  "schemaVersion": 1,
  "id": "beispiel.ressource-mit-mc-versionen",
  "name": "Ressource mit MC-Versionen",
  "category": "texturen",
  "author": {
    "name": "Vitrine-Testfixture"
  },
  "description": "GATE70-FOLLOW: Klasse-A-Paket, das 'minecraftVersions' optional ausfuellt -- fuer die Detailseite im Mod (PackageDetailHeader#minecraftVersions).",
  "license": "MIT",
  "repository": "https://example.com/vitrine-testfixture/ressource-mit-mc-versionen",
  "minecraftVersions": [
    "1.21.1",
    "1.21.4"
  ],
  "versions": [
    {
      "version": "1.0.0",
      "vpkgUrl": "https://example.com/vitrine-testfixture/ressource-mit-mc-versionen/releases/download/v1.0.0/ressource-mit-mc-versionen.vpkg",
      "sha256": "0123456789abcdef0123456789abcdef0123456789abcdef0123456789abcdef",
      "signature": "cUUn6jiavQB8sqnWFcXQvmZWp/yQEp1h1sAuHnW0fCGQkYh8q2I6cv8covRmS3g4bJS5VWl4zeQ6c54ilFrkZQ==",
      "size": 1024,
      "publishedAt": "2026-09-24T00:00:00.000Z"
    }
  ],
  "latestVersion": "1.0.0",
  "updatedAt": "2026-09-24T00:00:00.000Z"
}
